<?xml version="1.0" encoding="UTF-8"?>
<!DOCTYPE catalogue SYSTEM "catalogue-items.dtd">
<catalogue>
  <meta>
    <exhibition_title>John Baldessari at Sprengel Museum Hannover</exhibition_title>
    <venue>Sprengel Museum Hannover</venue>
    <venue_qid>Q510144</venue_qid>
    <creator_name>John Baldessari</creator_name>
    <creator_qid>Q312793</creator_qid>
    <source_file>output-plan-b-readable.csv</source_file>
  </meta>
  <items>
    <item>
      <title>DUCK POND BAR, NATIONAL CITY, CALIFORNIA</title>
      <creator>John Baldessari</creator>
      <creator_qid>Q312793</creator_qid>
      <date>1967</date>
      <object_type>painting</object_type>
      <object_type_qid>Q3305213</object_type_qid>
      <materials>Acrylfarbe; Fotoemulsion auf Leinwand</materials>
      <materials_qids/>
      <dimensions>
        <height_cm>152</height_cm>
        <width_cm>170</width_cm>
        <depth_cm/>
      </dimensions>
      <inventory_number/>
      <catalog_number/>
      <location>Sprengel Museum Hannover</location>
      <exhibited_at>Sprengel Museum Hannover</exhibited_at>
      <exhibited_at_qid>Q673907</exhibited_at_qid>
      <notes/>
    </item>
    <item>
      <title>THE FORMER SITE OF DUCK POND BAR, 3003 NATIONAL CITY BLVD., NATIONAL city CALIFORNIA</title>
      <creator>John Baldessari</creator>
      <creator_qid>Q312793</creator_qid>
      <date>1996 revisited</date>
      <object_type>painting</object_type>
      <object_type_qid>Q3305213</object_type_qid>
      <materials>Acrylfarbe; Fotoemulsion auf Leinwand</materials>
      <materials_qids/>
      <dimensions>
        <height_cm>150</height_cm>
        <width_cm>114</width_cm>
        <depth_cm/>
      </dimensions>
      <inventory_number/>
      <catalog_number/>
      <location>Sprengel Museum Hannover</location>
      <exhibited_at>Sprengel Museum Hannover</exhibited_at>
      <exhibited_at_qid>Q673907</exhibited_at_qid>
      <notes/>
    </item>
    <item>
      <title>SIZE /SHAPE (DESTINY)</title>
      <creator>John Baldessari</creator>
      <creator_qid>Q312793</creator_qid>
      <date>1988-89</date>
      <object_type>Photography and Painting</object_type>
      <object_type_qid/>
      <materials>Black and white photographs</materials>
      <materials_qids>Q125191</materials_qids>
      <dimensions>
        <height_cm>198</height_cm>
        <width_cm>259</width_cm>
        <depth_cm/>
      </dimensions>
      <inventory_number/>
      <catalog_number>Private collection, Courtesy Sonnabend Gallery, New York</catalog_number>
      <location>Sprengel Museum Hannover</location>
      <exhibited_at>Sprengel Museum Hannover</exhibited_at>
      <exhibited_at_qid>Q673907</exhibited_at_qid>
      <notes/>
    </item>
    <item>
      <title>POTATO AND LIGHTBULB</title>
      <creator>John Baldessari</creator>
      <creator_qid>Q312793</creator_qid>
      <date>1997-98</date>
      <object_type>photograph or installation component</object_type>
      <object_type_qid/>
      <materials>potted plants; lamps</materials>
      <materials_qids/>
      <dimensions>
        <height_cm/>
        <width_cm/>
        <depth_cm/>
      </dimensions>
      <inventory_number/>
      <catalog_number/>
      <location>Sprengel Museum Hannover</location>
      <exhibited_at>Sprengel Museum Hannover</exhibited_at>
      <exhibited_at_qid>Q673907</exhibited_at_qid>
      <notes/>
    </item>
    <item>
      <title>PRETZEL AND EAR</title>
      <creator>John Baldessari</creator>
      <creator_qid>Q312793</creator_qid>
      <date>1997-98</date>
      <object_type>photograph or installation component</object_type>
      <object_type_qid/>
      <materials>potted plants; lamps</materials>
      <materials_qids/>
      <dimensions>
        <height_cm/>
        <width_cm/>
        <depth_cm/>
      </dimensions>
      <inventory_number/>
      <catalog_number/>
      <location>Sprengel Museum Hannover</location>
      <exhibited_at>Sprengel Museum Hannover</exhibited_at>
      <exhibited_at_qid>Q673907</exhibited_at_qid>
      <notes/>
    </item>
    <item>
      <title>WALLPAPER: rooms with windows</title>
      <creator>John Baldessari</creator>
      <creator_qid>Q312793</creator_qid>
      <date>varies/1997-98</date>
      <object_type>wallpapers</object_type>
      <object_type_qid/>
      <materials>tapeten; maße variabel</materials>
      <materials_qids/>
      <dimensions>
        <height_cm/>
        <width_cm/>
        <depth_cm/>
      </dimensions>
      <inventory_number/>
      <catalog_number>PAGE 13</catalog_number>
      <location>Sprengel Museum Hannover</location>
      <exhibited_at>Sprengel Museum Hannover</exhibited_at>
      <exhibited_at_qid>Q673907</exhibited_at_qid>
      <notes/>
    </item>
    <item>
      <title>STRANGE</title>
      <creator>John Baldessari</creator>
      <creator_qid>Q312793</creator_qid>
      <date>1997</date>
      <object_type>Ink-jet auf Leinwand</object_type>
      <object_type_qid/>
      <materials>Ink jet on canvas</materials>
      <materials_qids>Q4259259</materials_qids>
      <dimensions>
        <height_cm>190</height_cm>
        <width_cm>152</width_cm>
        <depth_cm/>
      </dimensions>
      <inventory_number/>
      <catalog_number>GOWA SERIES</catalog_number>
      <location>Sprengel Museum Hannover</location>
      <exhibited_at>Sprengel Museum Hannover</exhibited_at>
      <exhibited_at_qid>Q673907</exhibited_at_qid>
      <notes/>
    </item>
    <item>
      <title>These Too</title>
      <creator>John Baldessari</creator>
      <creator_qid>Q312793</creator_qid>
      <date/>
      <object_type/>
      <object_type_qid/>
      <materials/>
      <materials_qids/>
      <dimensions>
        <height_cm/>
        <width_cm/>
        <depth_cm/>
      </dimensions>
      <inventory_number>23 22</inventory_number>
      <catalog_number>THESE TOO</catalog_number>
      <location>Sprengel Museum Hannover</location>
      <exhibited_at>Sprengel Museum Hannover</exhibited_at>
      <exhibited_at_qid>Q673907</exhibited_at_qid>
      <notes/>
    </item>
    <item>
      <title>These 10</title>
      <creator>John Baldessari</creator>
      <creator_qid>Q312793</creator_qid>
      <date>1997</date>
      <object_type>Ink-jet on canvas</object_type>
      <object_type_qid/>
      <materials>ink; canvas</materials>
      <materials_qids>Q127418; Q4259259</materials_qids>
      <dimensions>
        <height_cm>190</height_cm>
        <width_cm>152</width_cm>
        <depth_cm/>
      </dimensions>
      <inventory_number/>
      <catalog_number>THESE 10</catalog_number>
      <location>Sprengel Museum Hannover</location>
      <exhibited_at>Sprengel Museum Hannover</exhibited_at>
      <exhibited_at_qid>Q673907</exhibited_at_qid>
      <notes/>
    </item>
    <item>
      <title>ALL GETTING ON TOGETHER</title>
      <creator>John Baldessari</creator>
      <creator_qid>Q312793</creator_qid>
      <date>1999</date>
      <object_type>Digitaldruck, handgeschriebener Text, Acrylfarbe auf Leinwand/ Digital printing, hand lettering, acrylic paint on canvas</object_type>
      <object_type_qid/>
      <materials>Digitaldruck; handgeschriebener Text; Acrylfarbe auf Leinwand</materials>
      <materials_qids/>
      <dimensions>
        <height_cm>239</height_cm>
        <width_cm>239</width_cm>
        <depth_cm/>
      </dimensions>
      <inventory_number/>
      <catalog_number>114</catalog_number>
      <location>Sprengel Museum Hannover</location>
      <exhibited_at>Sprengel Museum Hannover</exhibited_at>
      <exhibited_at_qid>Q673907</exhibited_at_qid>
      <notes/>
    </item>
    <item>
      <title>REAL SHADOWS</title>
      <creator>John Baldessari</creator>
      <creator_qid>Q312793</creator_qid>
      <date>1989</date>
      <object_type>Digitaldruck, handgeschriebener Text, Acrylfarbe auf Leinwand/ Digital printing, hand lettering, acrylic paint on canvas</object_type>
      <object_type_qid/>
      <materials>Digitaldruck; handgeschriebener Text; Acrylfarbe auf Leinwand</materials>
      <materials_qids/>
      <dimensions>
        <height_cm>239</height_cm>
        <width_cm>239</width_cm>
        <depth_cm/>
      </dimensions>
      <inventory_number/>
      <catalog_number>112</catalog_number>
      <location>Sprengel Museum Hannover</location>
      <exhibited_at>Sprengel Museum Hannover</exhibited_at>
      <exhibited_at_qid>Q673907</exhibited_at_qid>
      <notes/>
    </item>
    <item>
      <title>Flying Saucer: Rainbow/Two Cyclists/Dog/Gorilla and Bananas/Chaotic Situation/Couple/Tortoise/Gunman (Fallen)</title>
      <creator>John Baldessari</creator>
      <creator_qid>Q312793</creator_qid>
      <date>1992</date>
      <object_type>photograph</object_type>
      <object_type_qid>Q125191</object_type_qid>
      <materials/>
      <materials_qids/>
      <dimensions>
        <height_cm/>
        <width_cm/>
        <depth_cm/>
      </dimensions>
      <inventory_number/>
      <catalog_number/>
      <location>Sprengel Museum Hannover</location>
      <exhibited_at>Sprengel Museum Hannover</exhibited_at>
      <exhibited_at_qid>Q673907</exhibited_at_qid>
      <notes/>
    </item>
    <item>
      <title>Three Running Figures (One Splashed), Trash Cans, and Poles (With Large Blue Shape)</title>
      <creator>John Baldessari</creator>
      <creator_qid>Q312793</creator_qid>
      <date>1995</date>
      <object_type>photograph</object_type>
      <object_type_qid>Q125191</object_type_qid>
      <materials/>
      <materials_qids/>
      <dimensions>
        <height_cm/>
        <width_cm/>
        <depth_cm/>
      </dimensions>
      <inventory_number/>
      <catalog_number/>
      <location>Sprengel Museum Hannover</location>
      <exhibited_at>Sprengel Museum Hannover</exhibited_at>
      <exhibited_at_qid>Q673907</exhibited_at_qid>
      <notes/>
    </item>
    <item>
      <title>Telephone (for Kafka)</title>
      <creator>John Baldessari</creator>